preprocessed_text,is_gambling_site
vegas situs judi slot online slot gacor resmi percaya samsung,1
sip situs judi slot online maxwin gacor slot percaya hoki samsung alilzdmodsitenavpc alilzdmodsitemenupc alilzdmodsitemenunavpc alilzdmoddesktopfooter,1
vegas situs judi slot online slot gacor resmi percaya samsung,1
slot link situs slot gacor akurat gampang menang x samsung alilzdmodsitenavpc alilzdmodsitemenupc alilzdmodsitemenunavpc alilzdmoddesktopfooter,1
slot online gacor pg soft demo slot pragmatic play gratis jamin maxwin slot online gacor,1
slot link situs slot gacor gampang menang baru samsung alilzdmodsitenavpc alilzdmodsitemenupc alilzdmodsitemenunavpc alilzdmoddesktopfooter,1
mahad situs gacor parah slot online maxwin slot demo x pragmatic play gratis,1
slot gacor jeniustoto akun demo slot online pragmtic play x gratis rupiah slot gacor jeniustoto,1
link slot gacor situs slot online gacor malam paten wajib coba samsung alilzdmodsitenavpc alilzdmodsitemenupc alilzdmodsitemenunavpc alilzdmoddesktopfooter,1
alilzdmodsitenavpc alilzdmodsitemenupc alilzdmodsitemenunavpc alilzdmoddesktopfooter,1
tokyo situs link slot online gacor gampang menang maxwin slot samsung alilzdmodsitenavpc alilzdmodsitemenupc alilzdmodsitemenunavpc alilzdmoddesktopfooter,1
slot slotfafa link situs slot gacor strategi gampang menang samsung alilzdmodsitenavpc alilzdmodsitemenupc alilzdmodsitemenunavpc alilzdmoddesktopfooter lzd,1
slot max situs raja slot online gacor slot resmi baik samsung alilzdmodsitenavpc alilzdmodsitemenupc alilzdmodsitemenunavpc alilzdmoddesktopfooter,1
slot situs judi slot gacor gampang menang maxwin rtp baru samsung,1
hawa situs slot gacor gampang menang maxwin samsung,1
saljud aplikasi mobileselamat datangsilahkan mendaftarmasukdaftarlupa rincian masuk gamessportsbookslotslive casinopokertangkasfishothershotpromosidownloadhubungi slot gacor malam inimain slot gacor malam salju d jamin gampang maxwin sensasionalmasukdaftarsportsbookslotslive casinopokertangkasfishothershotidr slots popularlebih gamegates of olympusqueen of wands extreme rhinozeusjoker s jewels popular gameswb sportpp suitelive pp slotv powerslot menit menit proses deposit menit menit proses tari hak cipta lindung salju d sensasi link slot online baru gacor parah malam inislot online judi marak indonesia main mesin online main main slot gacor wajib minimal umur orang bondong bondong main judi slot online kegacorannya parah slotmania giur gacor parah slot online tarik rasa slot gacor main main malam slot gacor malam rasa mudah agen resmi sensasi slot online baik pasti rasa salju d kenal salju d salah sedia slot online baru bonus minimal deposit rendah sempat senang slotmania rasa slot online baru beranda unduh masuk promosi live chat live chat masuk daftarlupa hot balakplay gss slot pp slotion suiteevo suitesportsbookwb sport sports sports sport wap g bti sportslotspp slotmg slotreel kingdomslot pgsoftlive jil v powerjokerhabanerosg slotcq ka gaming ion gss gp slotpt slotplaystar tsg slot ace netent nolimit city red tiger fastspin live casinopp suitewm suite vivo suite ebet suitesexy suitesa suiteion suiteevo suiteab suitegp suitept suiteag suitemg suites suite og suite dg suite sukagaming pokerbalak poker gaming p playtangkastangkasfishv power fish ace ka gamingjoker playtech others luxe d nex d connectcockft ka gaming promosimain slot gacor malam salju d jamin gampang maxwin sensasionalidr slots popularlebih gamemaingates of olympusmainqueen of wandsmain mainextreme rhinomainzeusmainjoker s jewels popular gamesmainwb sportmainpp suitemainlive mainpp slotmainv powermainslot lebih layanandepositwaktu minswithdrawwaktu minssistem pembayarandownload appsmember servicetentang kamisyarat amp ketentuanpribaditanggung jawabpusat infohubungi kamisalju d sensasi link slot online baru gacor parah malam inislot online judi marak indonesia main mesin online main main slot gacor wajib minimal umur orang bondong bondong main judi slot online kegacorannya parah slotmania giur gacor parah slot online tarik rasa slot gacor main main malam slot gacor malam rasa mudah agen resmi sensasi slot online baik pasti rasa salju d kenal salju d salah sedia slot online baru bonus minimal deposit rendah sempat senang slotmania rasa slot online baru salju d hak cipta informasidaftarbuka akun nikmat promosi taruh online hibur game kualitas premium kualitas sedia produk butuh pasar indonesia deposit tari cepat grafik tarik mudah akses browser pribadidengan terap teknologi aman canggih sedia informasi pribadi transaksi anggota aman produktaruhan sports amp taruh livekami tawar olahraga utama liga inggris la liga serie a liga champion ligue liga jerman nfl nba ncaa basketball tenis formula tawar taruh live tanding sepakbola bulan senang main live casinokami milik pilih tawar live dealer kasino tampil live lobby dealer asia cantik live baccarat live sic bo live dragon tiger live roulette slot online kasino main keno game slotratusan main slot tarik penuh warna peluang menang jackpot miliar rupiah takluk pusat infopusat bantuanlihat halaman faq atur taruh bantu game isi bantu buka akun deposit tari bantu teknis pembayarankami pilih langgan deposit tari transaksi proses cepat aman hubung kamijika bantu milik taruh sedia live chat whatsapp line skype telepon email promosi tawar khususpromosikami tawar bonus sambut anggota reload bonus promosi bulan produk rebate hari minggu program ucap terima kasih anggota aktif game mini ribu kartu game minggu klub rewarddapatkan poin taruh tukar produk fashion teknologi baru unjung halaman tukar hadiah hadiah kirim klub vipmenjadi vip layan profesionalisme baik ribu hadiah program promosi khusus vip providersportsbookslotslive casinogaplepoker tangkasfishlotteryotherssponsored by verified metode bayar atm gsc let e new promise resolve reject,1
rrq situs judi slot online gacor slot resmi percaya janji maxwin samsung,1
kumpar desktop homepage billboard position desktop homepage billboard position desktop homepage billboard position desktop homepage billboard position desktop billboard desktop article below image desktop intermezzo desktop sidebar bannerufhold stick position desktop sidebar bannerufhold stick position left skyscrapper right skyscrapper desktop headline native news card x position desktop headline native news card x position desktop headline native news card x position desktop headline native news card x position desktop content section widget header desktop zodiac widget header desktop ramadhan widget header desktop out of page desktop image showcase carousel widget footer desktop background image desktop over the page ads willy petrus arjuna simaremare judi online judi slot judi slot rajalela eparking pakai judi slot news nabila jayanti kumpar kumparannews fitra andrianto kumparanoto kumpar studio kumparanbisnis ema fitriyani nicha muslimawati sena pratama habib allbi ferdian kumparansains green initiative willy petrus arjuna simaremaremasukbuat tulisanentertainmentnewstekno amp sainsbisnisfood amp travelbola amp sportsotomotifwomanmombolanitalainnyavideo storygaleri fotokabar daerahpollingzodiaktentang kamipedoman media siberketentuan amp bijak privasipanduan komunitasperingkat penuliscara tulis kumparaninformasi kerja samabantuaniklankarirfacebookinstagramtwitterwhatsappyoutubetiktoklinespotify pt dynamo media breaking newsvideo storygreen initiativetrendingkumparanplusopini amp ceritaberandanewskonten penggunafenomena judi online slot gaya hidup bahaya era digital willy petrus arjuna simaremaremahasiswa universitas medan area juli wib baca menit tulis willy petrus arjuna simaremare wakil pandang redaksi kumparanperbesarmari jaga lingkung bahaya judi online edit by willykumparan hadir whatsapp channelfollowdi era digital mudah akses internet buka ruang aktivitas judi online salah jenis judi online kian populer slot online mudah temu warung internet laptop smartphone mudah akses jadi judi online slot gaya hidup kalang remaja mudah pengaruh tren ilustrasi main judi online slot edit by willydaya tarik judi online slot letak akses mudah fleksibel main taruh mana berkat situs judi online operasi jam hari transaksi bayar mudah sistem online m banking teknologi kembang tingkat kualitas daya tarik mesin slot canggih judi online slot bawa risiko finansial balut embel embel untung mesin slot rancang hasil untung kasino jangka main potensi hilang uang periode main bijak tetap batas taruh uang sesuai mampu ingat judi online slot untung finansial stabil fenomena judi online slot marak iming iming untung cepat untung semu dampak negatif seringkali sadar judi judi online slot picu ubah pola pikir arah materialistik emosi kendali serakah abur akal sehat dorong main taruh raih untung judi online tindak ilegal indonesia dasar pasal kuhp laku judi ancam pidana penjara maksimal denda rp juta aktivitas game online pasal ayat uu ite atur pidana penjara maksimal denda rp miliar edar game online akses larang judi online marak konten judi media sosial iklan gencar influencer legal aktivitas judi rugi masyarakat moralitas bangsa perilaku judi kompulsif timbul finansial sosial psikologis maju teknologi tinggi guna internet indonesia buka celah oknum oknum manfaat jahat judi online slot upaya rang judi online slot tingkat literasi digital tega hukum kunci utama edukasi bahaya judi online gencar generasi muda mari jaga lingkung bahaya judi online slot ingat hidup sejahtera bangun judi kerja keras dedikasi jujur judi onlinejudi slotjudi slot merajalelae parking pakai judi slot lapor tulisanutransitional i,0
hukum judi online kian berat atur baru hukum judi online kian berat atur baru pt justika siar publika beranda klinik pidana hukum judi ionlinei kian berat atur baru nafiatul munawaroh sh mh si pokrol bernadetha aurelia oktavira sh si pokrol nafiatul munawaroh sh mh si pokrol nafiatul munawaroh sh mh si pokrol muhammad raih nugraha sh si pokrol muhammad raih nugraha sh si pokrol erizka permatasari sh si pokrol nafiatul munawaroh sh mh si pokrol erizka permatasari sh si pokrol muhammad raih nugraha sh si pokrol renata christha auli sh si pokrol muhammad raih nugraha sh si pokrol rifdah rudi sh si pokrol katalog produkberlangganan prosemuaprosolusiinfo hukumevent amp awardsdaftarmasukproanalisis hukumanalisis komprehensif bilingual atur undang undang isu hukum terkinilegal intelligence updatesnewkonten eksklusif sumber a rancang atur bijak perintah terkinipusat datakoleksi atur undang undang putus adil sistematis terintegrasipremium storiesartikel premium komprehensif referensi praktis profesional hukumuniversity solutionsplatform tahu hukum integrasi jaring akademisi hukum depan indonesiasolusiregulatory compliance systemplatform pantau patuh hukum integrasi bas teknologi artificial intelligencedocument management systemsolusi kelola dokumen usaha platform terintegrasiizin usahasolusi lengkap diri izin badan usaha praktis terjangkaukonsultasi hukumsolusi hukum advokat berpengalamanpembuatan dokumenpembuatan dokumen hukum hukum cepat mudahwawasan hukumkliniktanya gratis isu hukumberitainformasi berita kini putar kembang hukum indonesiajurnalkoleksi artikel jurnal hukum kredibel referensi teliti andaeventinformasi seminar diskusi latih isu hukum terkinidata pribadipembahasan khusus uu lindung data pribadi bantu pantau patuh hukumawardspemeringkatan harga bas survei data komunitas hukum indonesiapkpapkpa hukumonline adi fh yarsi kurikulum komprehensif ajar terbaikonline courseplatform ajar hukum baik online materi ajar berkualitaspublikasi onlinelayanan publikasi komunitas hukum konten akvitasi sesuai butuh andaklinikberandatips hukumpidanakeluargaperdatakenegaraanprofesi hukumilmu hukumbisnispertanahan amp propertiketenagakerjaanperlindungan konsumenhak asasi manusiakekayaan intelektualteknologistartup amp umkmberitaberandautamaterbarukolomfotojedatajukprofilisu hangatpojok akpipojok inipojok kuhpkabar kampussurat pembacajurnalberandadaftar jurnalartikeleventberandakegiatan terkinievent organizerin house trainingarsip kegiatannarasumberdata premium analisis hukum dwibahasa pusat data atur putus adil artikel premium solusisolusi butuh masalah hukum manfaat teknologi wawas hukumlayanan edukasi informasi hukum percaya sesuai kembang hukum indonesia catalog productada hubung kamikatalog produkberlangganan probatalproduk pilih legal analysistemukan definisi istilah istilah hukum gratis percaya atur undang undang online course online course platform ajar hukum baik online fleksibel materi ajar kualitas mudah ajar regulatory compliance systemtemukan definisi istilah istilah hukum gratis percaya atur undang undang regulatory compliance systemtemukan definisi istilah istilah hukum gratis percaya atur undang undang regulatory compliance systemtemukan definisi istilah istilah hukum gratis percaya atur undang undang analisis atur putus legal intelligence berita klinik eventsada hubung kamidaftarmasuk hak cipta milik hukumonline cominfo hukumproinfo hukumsolusievents amp awardsklinikberitanewhukumonline streamdata pribadijurnalhometips hukumpidanakeluargaperdatakenegaraanprofesi hukumilmu hukumbisnispertanahan amp propertiketenagakerjaanperlindungan konsumenhak asasi manusiakekayaan intelektualteknologistartup amp umkmpersonalisasihalo upgrade paket langgan dapat fitur lengkapmulai langgan sekarangprofilkeluarada hubung kamibahasabahasa indonesiaenglish hukum judi online kian berat atur baru share beranda gt gt pidana gt hukum judi online ki pidanahukum judi online kian berat atur baru nafiatul munawaroh s h m hsi pokrolbacaan menit agustus pertanyaanbaru arah unjung situs tajuk lelang online indonesia situs skema lelang tawar aneh menang lelang tawar tinggi lelang harga barang rp lelang jam serta lomba lomba tawar poin beli situs poin rp tawar bidding hilang poin kalah poin indikasi judi uang poin kalah hilang sistem lelang benar judi hukum judi online terima kasih daftar isipertanyaandaftar isiintisari jawabanulasan lengkapklinik terkaitperjudian hukum judi online indonesiatagsintisari jawabankegiatan lelang online judi jenis judi nyata tindak pidana hukum judi online laku pidana dasar pasal ayat jo pasal ayat uu jelas baca ulas ulas lengkapterima kasih artikel mutakhir tiga artikel judul judi internet mana uu ite jangkau tim advokat suara adil kali publikasi jumat juli mutakhir kali sovia hasanah s h senin februari mutakhir kali mei klinik terkaitjerat hukum website judi online jul hukum main judi tanding sepak bola jul candu judi online aju ampu jul trading judi feb artikel dasar kuhp uu kuhp undang tanggal januari informasi hukum klinik hukumonline com siap mata tuju didik sifat lihat nyata sangkal lengkap nasihat hukum spesifik konsultasi langsung konsultan mitra justika ajar hukum online ajar kompeten biaya terjangkaumulai darirp lihat kelas hukum judi online judi apa larang larang praktik judi online marak judi online agam judi online jam slot togel poker judi bola mudah akses internet sebab hadiyanto kenneth tesis judul tindak pidana judi online media internet faktor melatarbelakangi kembang judi online tanah air upaya preventif perintah minim banyak situs situs judi online operasi jarang situs situs pasang iklan bayar situs mesin cari terang terang penyalahgunaan fasilitas perban mudah akses fasilitas perban disalahgunakan laku judi online transaksi judi hukum judi online indonesiadi indonesia atur atur perihal judi atur pasal pasal bis kuhp laku artikel terbit pasal pasal uu kuhp laku tanggal undang judi kuhp tentu pasal ayat kuhp ancam pidana penjara puluh pidana denda puluh juta rupiah barang izin sengaja tawar sempat main judi jadi cari sengaja usaha sengaja tawar sempat khalayak main judi sengaja usaha peduli sempat syarat penuh tata jadi main judi cari tentu pasal bis ayat kuhp bunyi ancam hukum penjara denda puluh juta rupiah barangsiapa sempat main judi ada langgar atur pasal barangsiapa main judi ada jalan pinggir masuk khalayak kecuali ada izin kuasa wenang dasar pasal ayat kuhp judi main untung untung main mahir latih main judi taruh putus lomba main ada lomba main taruh definisi judi nyata pasal ayat kuhp giat kategori judi r soesilo buku kitab undang undang hukum pidana kuhp komentar komentar lengkap pasal pasal orang ada main judi hukum pasal kuhp orang orang main kena hukum pasal bis kuhp judi kuhp uu tentu pasal uu pidana pidana penjara sembilan pidana denda kategori vi rp miliar orang izin tawar sempat main judi jadi mata cahari usaha judi tawar sempat main judi usaha judi lepas tidak syarat tata penuh sempat jadi main judi mata cahari tindak pidana ayat jalan profesi jatuh pidana tambah cabut hak pasal huruf f tentu pasal uu lengkap bunyi orang sempat main judi ada izin pidana pidana penjara pidana denda kategori iii rp juta hukum judi online uu iteadapun hukum judi online spesifik atur uu ite ubah kali uu tentu pasal ayat uu terang orang sengaja hak distribusi transmisi akses informasi dokumen elektronik milik muat judi masuk buat larang jelas pasal ayat uu terang tentu acu tentu judi tawar sempat main judi jadi mata cahari tawar sempat main judi usaha hukum judi online atur pasal ayat uu terang tentu orang sengaja hak distribusi transmisi akses informasi elektronik dokumen elektronik milik muat judi dipidanapenjara denda rp miliar jelas judi online simak artikel hukum iklan website arah judi simpul giat lelang online judi laku judi online pidana dasar pasal ayat jo pasal ayat uu pidana penjara maksimal denda rp miliar perihal hukum judi online konsep lelang moga manfaat dasar hukum kitab undang undang hukum pidana undang undang nomor informasi transaksi elektronik ubah undang undang nomor ubah undang undang nomor informasi transaksi elektronik ubah kali undang undang nomor ubah undang undang nomor informasi transaksi elektronik undang undang nomor kitab undang undang hukum pidana referensi r soesilo kitab undang undang hukum pidana kuhp komentar komentar lengkap pasal pasal bogor politeia hardiyanto kenneth tindak pidana judi online media internet tesis program pascasarjana program studi kaji ilmu polisi universitas indonesia pasal undang undang nomor kitab undang undang hukum pidana uu pasal ayat huruf f uu pasal ayat huruf c uu tagshukumhukumonlineinformasi transaksi elektronikinternetitelelangonlinepidanateknologiuu itepunya hukum hadap kirim pertanyaanatauchat sekarangmulai rp baca disclaimerpowered byklinik terbarusyarat rujuk talak meni sep jaksa tuntut bebas dakwa sep pancasila sumber hukum tinggi indonesia sep sanggah cpns aju sep keras kakak ipar kdrt sep lihat semuatips hukumlihat dasar hukum poligami indonesia prosedur nov lapor tindak pidana polisi prosedur des rujuk cabut gugat cerai adil sep dapat info lowong kerja hukum baru indonesia kunjung law firm buka lowong junior mid level associateassegaf hamzah and partners buka lowong kerja daftar daftar lowong kerja associate firma hukumlowongan kerja legal internship top law firm catat lowong kerja legal staff bumnsegera daftar usaha buka lowong legal internshiplowongan human resource legal baru agustus butuh artikel lihat semuaartikel selanjutnyaapakah jam kerja cpns pns pantau wajib hukum usaha links first,0
christovel ramot klikdokter sehat mental sehat mental hubung klikdokter instagram facebook twitter youtube tiktok layan dokter temu dokter layan medis u lab info obat info sakit kalstore layan janji dokter belanja sehat info obat info sakit temu dokter layan medis u lab dokter belanja sehat hallo bumil info obat info sakit klikdokter bijak privasi syarat tentu hubung faq karier kolaborasi korporasi tenaga sehat fasilitas sehat neocate le minerale neocate le minerale ucpuejaga sehatmuucbruesemudah klik sajaucpue ucpuejaga sehatmuucbruesemudah klik sajaucpue ucpuejaga sehatmuucbruesemudah klik sajaucpue ucpuejaga sehatmuucbruesemudah klik sajaucpue uchuesekarang solusi sehat mudah klik sajauchue uchuesekarang solusi sehat mudah klik sajauchue uchuesekarang solusi sehat mudah klik sajauchue sehat mental sehat mental sehat mental sehat mental sehat mental sehat mental sehat mental sehat mental sehat mental sehat mental sehat mental sehat mental sehat mental indonesian rupiah lokasi kamumasuktambah lokasi kamutanya doktertemu dokterlayanan medis amp labinfo stem cellinfo obatinfo penyakitdownload aplikasi klikdokter dihomepsikologikesehatan mental alas candu judi onlinekesehatan mental alas candu judi onlinechristovel ramot jul tinjau dr gia pratamabagikandi era digital candu judi online kian resah artikel kupas tuntas faktor faktor picu strategi cegah tangan dasar papar dr giakecanduan judi online berat era digital faktor kontribusi kembang candu paham alas candu judi online bantu cegah tangan tim content klikdokter diskus dr gia pratama alas candu judi online artikel tips henti candu judi online aksesibilitas mudahjudi online mudah akses judi internet perangkat pintar orang main pergi kasino fisik mudah akses orang rentan candu anonimitasjudi online tawar tingkat anonimitas banding judi fisik anonimitas nyaman judi takut nilai sosial dampak negatif hakim orang alam sensor menariksitus judi online kali rancang grafis tarik suara hibur fitur interaktif alam judi senang adiktif alam sensoris luap main ilusi kontrolbanyak main judi online ilusi main milik kontrol hasil main main libat terampil putus strategis main pengaruh hasil nyata hasil sepenuh gantung untung menang seringkasino online kali atur main menang jaga main main menang dorong dopamin kuat main menang henti sulit keuanganbeberapa orang alih judi online harap cepat hasil uang hadap sulit uang harap menang uang motivator kuat judi alami rugi artikel terapi khusus atas candu game online emosional psikologisorang emosional psikologis depresi cemas stres judi online lari asa negatif alih pikir judi alih perhati asa euforia adiktif pengaruh sosialtekanan teman lingkung sosial main judi tingkat cenderung libat judi online teman kenal menang uang dorong individu coba untung kampanye pasar agresifsitus judi online kali strategi pasar agresif iklan tarik bonus daftar promosi khusus tarik perhati dorong individu judi bonus insentif judi untung sulit tolak kejar kerugianseseorang alami rugi kali dorong judi upaya uang hilang kejar rugi perangkap siklus judi intens rugi kurang paham probabilitasbanyak main judi online sepenuh paham probabilitas peluang menang kurang paham menang judi alami rugi terus puas segerajudi online tawar puas hasil main singkat puas instan mikat main rasa euforia menang kurang awas batasantidak awas batas ketat judi online mudah jerumus candu batas uang judi habis uang sadar fitur free play situs judi online tawar mode free play main coba main uang sungguh bahaya mode menang mode main biasa main percaya menang dorong alih mode taruh uang sungguh genetik biologisbeberapa teliti candu candu judi milik komponen genetik biologis orang milik riwayat keluarga candu rentan candu judi online artikel dampak negatif tonton cek khodam tiktokkecanduan judi online serius dampak negatif hidup aspek uang sosial sehat mental dampak negatif lebar keluarga lingkung negara paham faktor faktor sebab candu langkah cegah tangan kenal alami candu judi cari bantu profesional dukung orang orang dekat terlambatjika topik layan dokter konsultasi online psikolog janji psikolog langsung layan temu dokter temu layan sehat lainnnya klikdokter yuk download aplikasi klikdokter informasi sehat belanja perlu sehat kalstore lupa jagasehatmu ya konsultasi dokter terkaitlihat fitri dian hapsari s psi m psi psikologpsikolog tahunmulai darirp konsultasi dhebby edriany s psi m psi psikologpsikolog tahunmulai darirp konsultasi anggreini ade putri remiyanto s psi m psi psikologpsikolog tahunmulai darirp konsultasiartikel terkaitkesehatan mentallabubu tahan kepo fomo sep sehat mentalfufufafa milik burner account cenderung milik eq iq rendah sep sehat mentalmengapa hati gembira obat manjur sep sehat mentalfufufafa cenderung netizen milik burner account lampias emosi sep sehat mentalmengenal fenomena lonely deaths tinggal sepi sep tampil,0
